{
  "schema_version": "wfa_run",
  "strategy_config_path": "workspace/runs/strategy-run-voo-gld-yfinance-daily-momentum90-sma250-rotation-example.json",
  "engine": "unified_portfolio_wfa",
  "platform": {
    "run_type": "example",
    "display_label": "Rolling Validation | VOO GLD | 90D Momentum 250D SMA Filter | yfinance | Example"
  },
  "windowing": {
    "mode": "rolling",
    "size_mode": "ratio",
    "target_window_count": 6,
    "train_ratio": 0.6,
    "test_ratio": 0.2,
    "step_size": 126
  },
  "optimizer": {
    "type": "grid",
    "objectives": ["sharpe", "calmar"],
    "primary_objective": "sharpe",
    "candidate_limit": 1,
    "random_seed": 42,
    "selection_constraints": {
      "enabled": false
    }
  },
  "acceptance": {
    "require_positive_oos": false,
    "min_oos_sharpe": 0.0,
    "min_oos_calmar": 0.0,
    "min_oos_is_ratio": 0.0
  },
  "outputs": {
    "selected_optimum": true,
    "candidate_diagnostics": true,
    "window_backtests": true
  },
  "metadata": {
    "example": true,
    "local_research_only": true,
    "strategy_id": "voo_gld_momentum90_sma250_rotation_yfinance_rolling_validation_example",
    "notes": [
      "References the fixed VOO/GLD momentum rotation example in workspace/runs.",
      "The referenced strategy has no parameter_domains, so the unified WFA runtime treats this as rolling validation rather than parameter optimization.",
      "Use it to inspect rolling out-of-sample mechanics, not as a WFA pass or asset-allocation robustness claim.",
      "This example does not certify profitability, live trading, broker readiness, tradability, or investment advice."
    ]
  }
}
